{
  "issue_id": "weforge-001",
  "scope": "The launch window of WeForge: the initial platform commit through the first month of operation, including the May outage as recorded — and as not recorded — by the surviving sources.",
  "corpus_map": [
    {
      "locator": "git:forge/weforge.git",
      "description": "The platform repository: initial commit, service scaffolding, deployment configuration.",
      "kind": "git-history",
      "assessment": {
        "reliability": "primary",
        "freshness": "current",
        "completeness": "full",
        "ownership": "weforge operators"
      }
    },
    {
      "locator": "tracker:weforge/meta",
      "description": "The platform's own meta tracker: launch announcement, service requests, the outage report.",
      "kind": "issue-tracker",
      "assessment": {
        "reliability": "primary",
        "freshness": "current",
        "completeness": "partial",
        "ownership": "weforge operators"
      }
    },
    {
      "locator": "docs/ops-journal.md",
      "description": "Hand-kept operations journal. Entries are dated but irregular; several weeks have no entries at all.",
      "kind": "orientation-doc",
      "assessment": {
        "reliability": "secondary",
        "freshness": "aging",
        "completeness": "fragmentary"
      },
      "discovered_from": "tracker:weforge/meta"
    }
  ],
  "inherited_threads": [],
  "corpus_gaps": [
    {
      "description": "No deployment log or postmortem covers the recovery from the May outage; the tracker records the outage opening but nothing records how service was restored.",
      "material": true,
      "gap_evidence": "tracker:weforge/meta#41 reports the outage and was closed without a resolution comment; docs/ops-journal.md has no entry between May 12 and May 27."
    }
  ]
}
